author,body,like
Диана,кино тусиретии унайды бырак куйеуынен соккы алды дегени маскара кайсысын тандарымды былми калдымг,-3
Улдана Мейрамов,жарайсыз сіз сияқты жандар көп болса деймін.Сізден басқа ешкім өз елінің абыройын ойламайд,3
Рр,Мяяяя ну она крепки орешек молодец,0
Аноним,Алла Жар болсын! Қайта өмірге келуіңізбен құттықтаймыз!Өміріңіз ұзақ болсын Әумин,0
MEDEU,Алла Жар болсын! Қайта өмірге келуіңізбен құттықтаймыз!Өміріңіз ұзақ болсын Әумин,1
Айкош,Қазақ әйелдері барлық қиыншылықты көріп жатыр басқа елдерде тез ажырасып жатады 10 жыл шыдап келген барлығын,0
Айкош,Бірақ өміргой деп қойа саламыз басына салғанын кореді бәрін қолдап жасап аламыз өмірдіде адамдардыд,1
Бауыржан,"Айналайын, киноны кәсіпқой режиссерлер түсіргені мақұл, саған продюсерлік болады, және үлкен жетістіктерге жеттің",0
